{
  "provenance": {
    "artifact_id": "wgf:playability-report:ice-slide:20261003-06",
    "artifact_type": "playability-report",
    "schema_version": "1.2.0",
    "title_id": "ice-slide",
    "produced_by": {
      "role": "qa",
      "actor": "automation"
    },
    "produced_at": "2026-10-03T10:28:10Z",
    "inputs": [
      {
        "artifact_id": "wgf:game-design:ice-slide:20261003-06",
        "artifact_type": "game-design",
        "content_hash": "sha256:54887df7763a4d5d445d0bf2bc17ded2a3eaa84f37542077ecd3486ee41798d8"
      },
      {
        "artifact_id": "wgf:prototype-report:ice-slide:20261003-08",
        "artifact_type": "prototype-report",
        "content_hash": "sha256:413cf9aa6fb744c84eda38825777c181de54d502d0a96b40d0f5dfd65c73e118"
      },
      {
        "artifact_id": "wgf:scaffold-record:ice-slide:20261003-03",
        "artifact_type": "scaffold-record",
        "content_hash": "sha256:afb8e376cf2c4caa033cf29a39d26d40fa881bf65c68d7e2006a79f8bc853adf"
      }
    ],
    "content_hash": "sha256:30266ab5243a13923cea2b2a22ef0939f06b03ed4ff1ecff9b9ddaac3cd0cd78",
    "status": "draft"
  },
  "title_id": "ice-slide",
  "commit": "c0b0e7e6d4a6477aa9757d03afc22241e852d980",
  "measurement_class": "automation-bot",
  "projects": [
    {
      "id": "desktop",
      "viewport": {
        "width": 1280,
        "height": 720
      },
      "ran": true,
      "page_errors": []
    },
    {
      "id": "mobile",
      "viewport": {
        "width": 393,
        "height": 851
      },
      "ran": true,
      "page_errors": []
    }
  ],
  "checks": [
    {
      "id": "probe.present",
      "project": "desktop",
      "required": true,
      "summary": "window.__wgf__.play.snapshot() answered while the game started",
      "status": "PASS"
    },
    {
      "id": "probe.valid",
      "project": "desktop",
      "required": true,
      "summary": "snapshots match the play-probe schema and carry the contract's metrics",
      "status": "PASS",
      "measured": {
        "schema_problems": [],
        "missing_metrics": [],
        "content_problems": []
      }
    },
    {
      "id": "start.playable",
      "project": "desktop",
      "required": true,
      "summary": "play began 1530 ms after navigation",
      "status": "PASS",
      "measured": 1530,
      "expected": "<= 5000 ms"
    },
    {
      "id": "start.objective",
      "project": "desktop",
      "required": true,
      "summary": "80% of the objective's words were on screen in the first 3 s of play",
      "status": "PASS",
      "measured": 0.8,
      "expected": ">= 0.6 of the words of build_spec.experience.goal.statement",
      "frames": [
        "first-session-1s"
      ]
    },
    {
      "id": "idle.grace",
      "project": "desktop",
      "required": true,
      "summary": "with no input for 10000 ms, play was not lost",
      "status": "PASS",
      "expected": "not lost within 10000 ms without input"
    },
    {
      "id": "act.acknowledged",
      "project": "desktop",
      "required": true,
      "summary": "every action changed the frame: {'slide-up': 0.015, 'slide-down': 0.0148, 'slide-left': 0.1928, 'slide-right': 0.0155}",
      "status": "PASS",
      "measured": {
        "slide-up": 0.015,
        "slide-down": 0.0148,
        "slide-left": 0.1928,
        "slide-right": 0.0155
      },
      "expected": ">= 0.002 of pixels"
    },
    {
      "id": "win.reachable",
      "project": "desktop",
      "required": true,
      "summary": "good play reached `won` after 6 inputs",
      "status": "PASS",
      "measured": {
        "reached": "won",
        "inputs": 6,
        "genre_win_shape": "goal-state-reached"
      }
    },
    {
      "id": "lose.reachable",
      "project": "desktop",
      "required": true,
      "summary": "bad play ended lost",
      "status": "PASS",
      "measured": {
        "reached": "lost"
      },
      "frames": [
        "end-lost",
        "state-lost",
        "state-retry"
      ]
    },
    {
      "id": "restart.works",
      "project": "desktop",
      "required": true,
      "summary": "retry (input:retry) returned to play in 19 ms; a restart inside the unit returned to play with its progress at 0",
      "status": "PASS",
      "measured": {
        "playingMs": 19,
        "reset": true,
        "reset_in_unit": {
          "clicked": "input:restart",
          "playingMs": 202,
          "before": {
            "unit_id": "l-01",
            "unit_index": 1,
            "unit_count": 6,
            "unit_kind": "level",
            "objective": "Reach the goal tile of l-01 in at most 12 moves.",
            "progress": {
              "metric": "goal-reached",
              "value": 0,
              "target": 1
            }
          },
          "after": {
            "unit_id": "l-01",
            "unit_index": 1,
            "unit_count": 6,
            "unit_kind": "level",
            "objective": "Reach the goal tile of l-01 in at most 12 moves.",
            "progress": {
              "metric": "goal-reached",
              "value": 0,
              "target": 1
            }
          },
          "metrics_before": {
            "best": 0,
            "moves-left": 11,
            "solve-time": 0,
            "keys-doors": 0,
            "stars": 0,
            "unit": 1,
            "goal-reached": 0,
            "difficulty.depth": 0.05,
            "difficulty.move-limit": 0.03,
            "difficulty.board-complexity": 0.1,
            "difficulty.piece-variety": 0.15
          },
          "metrics_after": {
            "best": 0,
            "moves-left": 12,
            "solve-time": 0,
            "keys-doors": 0,
            "stars": 0,
            "unit": 1,
            "goal-reached": 0,
            "difficulty.depth": 0.05,
            "difficulty.move-limit": 0.03,
            "difficulty.board-complexity": 0.1,
            "difficulty.piece-variety": 0.15
          }
        }
      },
      "expected": "<= 3000 ms, moves-left reset"
    },
    {
      "id": "entities.visible",
      "project": "desktop",
      "required": true,
      "summary": "player, threats and goals are drawn on screen and large enough",
      "status": "PASS",
      "measured": {
        "player": {
          "samples": 430,
          "visible": 430,
          "visible_share": 1.0,
          "median_area": 0.0026
        },
        "threat": {
          "samples": 10320,
          "visible": 10320,
          "visible_share": 1.0,
          "median_area": 0.0026
        },
        "goal": {
          "samples": 430,
          "visible": 430,
          "visible_share": 1.0,
          "median_area": 0.0026
        }
      },
      "expected": {
        "min_area_fraction": 0.002,
        "min_visible_share": 0.5
      }
    },
    {
      "id": "frames.readable",
      "project": "desktop",
      "required": true,
      "summary": "frames during play are lit and have contrast",
      "status": "PASS",
      "measured": {
        "first-session-1s": {
          "mean_luminance": 44.54,
          "contrast": 86.53,
          "lit_share": 0.2053
        }
      },
      "expected": {
        "lit_share": ">= 0.01 at luminance >= 64",
        "mean_luminance": "<= 225",
        "contrast": ">= 18"
      },
      "frames": [
        "first-session-1s"
      ]
    },
    {
      "id": "content.units_reachable",
      "project": "desktop",
      "required": true,
      "summary": "units [1, 2, 3, 4] were played in the design's order, each entered within 1500 ms of the previous one ending",
      "status": "PASS",
      "measured": {
        "units_reached": [
          1,
          2,
          3,
          4,
          5
        ],
        "transitions": [
          {
            "from": 1,
            "to": 2,
            "at_ms": 2100,
            "how": "won",
            "since_end_ms": 977
          },
          {
            "from": 2,
            "to": 3,
            "at_ms": 4471,
            "how": "won",
            "since_end_ms": 353
          },
          {
            "from": 3,
            "to": 4,
            "at_ms": 7210,
            "how": "won",
            "since_end_ms": 378
          },
          {
            "from": 4,
            "to": 5,
            "at_ms": 10150,
            "how": "won",
            "since_end_ms": 309
          }
        ],
        "stopped": "max units",
        "truncated": true
      },
      "expected": "units [1, 2, 3, 4] in order, each within 1500 ms of the previous one reaching `won` or its progress target",
      "frames": [
        "unit-1-1s",
        "unit-2-1s",
        "unit-3-1s",
        "unit-4-1s"
      ]
    },
    {
      "id": "content.objective_shown",
      "project": "desktop",
      "required": true,
      "summary": "every played unit showed its objective: {'l-01': 1.0, 'l-02': 1.0, 'l-03': 1.0, 'l-04': 1.0, 'l-05': 1.0}",
      "status": "PASS",
      "measured": {
        "l-01": 1.0,
        "l-02": 1.0,
        "l-03": 1.0,
        "l-04": 1.0,
        "l-05": 1.0
      },
      "expected": ">= 0.6 of the words of each unit's `objective`"
    },
    {
      "id": "content.win_lose_per_unit",
      "project": "desktop",
      "required": true,
      "summary": "every unit the traverse left was completed, and bad play failed a unit that states a failure; still in play when the traverse stopped (max units), so its completion was not judged: l-05",
      "status": "PASS",
      "measured": {
        "not_completed": [],
        "in_progress": [
          "l-05"
        ],
        "stopped": "max units",
        "lost_in_unit": "l-01",
        "lose_reached": "lost"
      }
    },
    {
      "id": "difficulty.axes_progress",
      "project": "desktop",
      "required": true,
      "summary": "the build carries the design's difficulty, and it holds or rises on depth, move-limit, piece-variety; the traversal stopped short of the design's units, so the rise across the set was not judged",